TIPO;ORIGEN;TITULO;AUTOR;AÑO;DESCRIPCION;CUANTIA_SEGURO;NUMERO_POLIZA;TECNICA_CUADRO;MATERIAL_ESCULTURA;COLOR_FOTOGRAFIA;DURACION_AV;IDIOMA_AV;ANCHURA_CM;ALTURA_CM;PROFUNDIDAD_CM;TEMPERATURA;HUMEDAD
CUADRO;EXTERNA;El beso;Gustav Klimt;1908;La obra representa dos amantes, y pertenece al periodo dorado de Klimt.;300000;SEG988976;Oleo sobre tela;;;;;180;180;;0--20;40--65
CUADRO;EXTERNA;Guernika;Pablo Picasso;1937;Cuadro simbolico pintado en blanco, negro y grises. De estilo cubista, surrealista y expresionista.;800000;SEG984560;Oleo sobre lienzo;;;;;776.6;349.3;;5--20;40--65
CUADRO;EXTERNA;Autorretrato con mono;Frida Kahlo;1938;Kahlo aparece con un collar de huesos y una blusa tipicos de la indumentaria tradicional mexicana, junto a su mascota Fulang-Chang, un mono al que adoraba.;300000;SEG980006;Oleo sobre masonita;;;;;40.6;30.5;;10--20;35--65
ESCULTURA;EXTERNA;For the love of God;Damien Hirst;2007;Molde de platino de una calavera humana incrustada con 8.601 diamantes.;200000;SEG910076;;Diamante;;;;17.1;12.7;19;;
ESCULTURA;EXTERNA;Elogio de la luz xvi;Eduardo Chillida;1971;Obra escultural que fusiona la solidez del material con la presencia de la luz.;100000;SEG018940;;Alabastro;;;;19;37;30;;
FOTOGRAFIA;CENTRO;Muerte de un miliciano;Robert Cappa;1936;Fotografia tomada en la localidad andaluza de Espejo, el 5 de septiembre de 1936, que muestra un soldado republicano que cae mientras una de sus manos sostiene un arma.;1000;SEG214448;;;Blanco y negro;;;31.8;45.4;;;
FOTOGRAFIA;CENTRO;V-J day in Times Square;Alfred Eisenstaedt;1945;Fotografia de un marino estadounidense besando a una mujero de blanco durante las celebraciones del dia de la victoria sobre Japon en 1945.;1000;SEG837656;;;Blanco y negro;;;47.8;34.4;;16--18;30--50
AUDIOVISUAL;EXTERNA;Sun in your head;Wolf Vostell;1963;El video muestra imagenes deformadas y manipuladas de John F. Kennedy, un desfile militar, presentadoras de noticias y politicos que se saludan, entre otras.;1000;SEG188300;;;;00h05m30s;n/a;;;;;
AUDIOVISUAL;EXTERNA;Deserts;Bill Viola;1994;Collage de imagenes para una actuacion en directo del compositor vanguardista Edgard Varese.;1000;SEG000366;;;;00h26m00s;n/a;;;;;